GBuild,Chr,Start,End,Ref,Alt,Hom/Het,GenetOri,Technique,Ethnicity,Variant_Description,Pop,refGene,AAChange,HGVS NM,HGVS NG,HGVS NP,MutationEffect,dbSNP,PatientDescription,Disease,Inheritance,ClinVarID,OMIM,PMID,Record_ID,Gene_clean,Chr_clean,Start_int,End_int,Position_Mb,Variant_key_hg38,Variant_type_inferred,Zygosity_clean,Inheritance_clean,Disease_filled,Disease_fill_basis,Broad_Disease_Class,Affected_System_inferred,Phenotype_terms_inferred,Population_Context,Consanguinity_Mentioned,Pakistan_Relevance,ClinVar_ID_clean,ClinVar_URL,ClinVar_Search_URL,OMIM_ID_clean,OMIM_URL,OMIM_Search_URL,GeneCards_URL,Human_Protein_Atlas_URL,GTEx_Gene_URL,Ensembl_REST_symbol_URL,PubMed_PMID_clean,PubMed_URL,PubMed_Gene_Pakistan_Search_URL,Data_Completeness_Score_percent,Curation_Status,Curator_Notes,Gene_Symbol_Curated,HGVS_cDNA_Curated,HGVS_Protein_Curated,Variant_Class_Corrected,Variant_Length_bp_Rough,Variant_Class_Evidence,MutationEffect_Standardized,Disease_Category_Curated,Affected_System_Curated,Ethnicity_Curated,Ethnicity_Evidence_Level,Ethnicity_Source_URL,Primary_Paper_Title,Primary_Paper_URL,Primary_Paper_DOI_URL,Reference_Link_For_Streamlit,OMIM_Search_Curated_URL,GeneCards_Curated_URL,ClinVar_Curated_Search_URL,HPA_Search_URL,GTEx_Gene_URL_Curated,Curation_Action,Curation_Confidence,Curation_Notes_2026_05_07
hg38,chr6,104728094,104859919,T,C,Het,germline,Exome and Sanger Sequencing,Pashtun,no,Pakistan,HACE1,L117S,NM_020771.4: c.350T>C,NG_046782.1: g.21645T>C,NP_065822.2: p. Leu117Ser,Missense Uncertain significance,,"The study focused on a Pakistani family with individuals affected by NDD syndrome with clinical features including ID, epilepsy, spasticity, global developmental delay, and psychomotor impairment in two siblings of a consanguineous",Spastic Paraplegia-Severe Developmental Delay-Epilepsy Syndrome,AR,1878618,610876,,PK_NEURO_0001,HACE1,6,104728094,104859919,104.728,hg38:6:104728094-104859919:T:C,Missense,Heterozygous,Autosomal recessive,Spastic Paraplegia-Severe Developmental Delay-Epilepsy Syndrome,Original Disease column,Intellectual disability / NDD,Brain / CNS,developmental delay; epilepsy; spasticity; spastic paraplegia,Pashtun; Pakistan,Yes,Pakistani population/family/cohort record,1878618,https://www.ncbi.nlm.nih.gov/clinvar/variation/1878618/,https://www.ncbi.nlm.nih.gov/clinvar/?term=HACE1+NM_020771.4%3A+c.350T%3EC,610876,https://omim.org/entry/610876,https://omim.org/search?index=entry&search=HACE1,https://www.genecards.org/cgi-bin/carddisp.pl?gene=HACE1,https://www.proteinatlas.org/search/HACE1,https://gtexportal.org/home/gene/HACE1,https://rest.ensembl.org/xrefs/symbol/homo_sapiens/HACE1?object_type=gene;content-type=application/json,,,https://pubmed.ncbi.nlm.nih.gov/?term=%28HACE1%5BTitle%2FAbstract%5D%29+AND+Pakistan%2A+AND+%28Spastic+Paraplegia-Severe+Developmental+Delay-Epilepsy+Syndrome%29,89.5,Needs curation: PMID,Automated normalization plus source-link enrichment. Database fields should be reviewed before clinical use.,HACE1,NM_020771.4:c.350T>C,,Missense,,Inferred from HGVS/Ref/Alt/MutationEffect/old column K; not a clinical pathogenicity assertion,Missense,Neurodevelopmental / intellectual disability,Brain / CNS,Pashtun,row-level value from original sheet; spelling normalized only,,,,,,https://www.omim.org/search?search=HACE1,https://www.genecards.org/cgi-bin/carddisp.pl?gene=HACE1,https://www.ncbi.nlm.nih.gov/clinvar/?term=HACE1+NM_020771.4%3Ac.350T%3EC,https://www.proteinatlas.org/search/HACE1,https://gtexportal.org/home/gene/HACE1,Needs publication reference,Low,
hg38,Chr8,142872357,142879825,,,Hom,,Microarrays,Sindh,8p22 between SNPs rs6989820 and rs2237834 region of 12.494 Mb,Pakistan,TUSC3,,,,,,,"four-generation Pakistani family with six affected individuals was analyzed. The affected individuals exhibited severe psychomotor developmental delay and cognitive dysfunction, while their major clinical presentations were normal",nonsyndromic intellectual disability (ARNS-ID),AR,,601385,21513506,PK_NEURO_0002,TUSC3,CHR8,142872357,142879825,142.872,hg38:CHR8:142872357-142879825::,Unclassified,Homozygous,Autosomal recessive,nonsyndromic intellectual disability (ARNS-ID),Original Disease column,Intellectual disability / NDD,Brain / CNS,intellectual disability; developmental delay,Sindh; Pakistan,Not stated,Pakistani population/family/cohort record,,,https://www.ncbi.nlm.nih.gov/clinvar/?term=TUSC3,601385,https://omim.org/entry/601385,https://omim.org/search?index=entry&search=TUSC3,https://www.genecards.org/cgi-bin/carddisp.pl?gene=TUSC3,https://www.proteinatlas.org/search/TUSC3,https://gtexportal.org/home/gene/TUSC3,https://rest.ensembl.org/xrefs/symbol/homo_sapiens/TUSC3?object_type=gene;content-type=application/json,21513506,https://pubmed.ncbi.nlm.nih.gov/21513506/,https://pubmed.ncbi.nlm.nih.gov/?term=%28TUSC3%5BTitle%2FAbstract%5D%29+AND+Pakistan%2A+AND+%28nonsyndromic+intellectual+disability+%28ARNS-ID%29%29,63.2,"Needs curation: MutationEffect, ClinVarID, HGVS NM, HGVS NP",Automated normalization plus source-link enrichment. Database fields should be reviewed before clinical use.,TUSC3,,,Copy-number / large genomic region,12494000,Inferred from HGVS/Ref/Alt/MutationEffect/old column K; not a clinical pathogenicity assertion,Copy-number / large genomic region,Neurodevelopmental / intellectual disability,Brain / CNS,Sindhi / Sindh regional,row-level value from original sheet; spelling normalized only,,A novel deletion mutation in the TUSC3 gene in a large consanguineous Pakistani family with autosomal-recessive nonsyndromic intellectual disability,https://pubmed.ncbi.nlm.nih.gov/21513506/,,https://pubmed.ncbi.nlm.nih.gov/21513506/,https://www.omim.org/search?search=TUSC3,https://www.genecards.org/cgi-bin/carddisp.pl?gene=TUSC3,https://www.ncbi.nlm.nih.gov/clinvar/?term=TUSC3,https://www.proteinatlas.org/search/TUSC3,https://gtexportal.org/home/gene/TUSC3,Needs manual variant review,Medium,ClinGen summary reports a 170 kb homozygous deletion of the entire TUSC3 gene in six affected individuals.
hg38,Chr1q31.3,197084121,197146694,,,Hom,germline,Whole Exome Sequencing,Pashtun,c.7782_7783delGA,Pakistan,MCPH,,NM_018136.5:c.7782_7783delGA,NG_015867.1:g.50226_50227delGA,NP_060606.3:p.Lys2595Serfs*6,Frameshift and protein truncation,rs199422173,"consanguineous families patients with primary microcephaly, exhibited severely reduced head circumference, sloping forehead, underdeveloped speech ability, delayed ambulation, and no facial dysmorphism. They were born to asymptomatic parents",primary microcephaly with intellectual disability,AR,21606,608716 (605481.0011),31853109,PK_NEURO_0003,MCPH,CHR1Q31.3,197084121,197146694,197.084,hg38:CHR1Q31.3:197084121-197146694::,Frameshift,Homozygous,Autosomal recessive,primary microcephaly with intellectual disability,Original Disease column,Primary microcephaly,Brain / CNS; Skeletal,microcephaly; intellectual disability,Pashtun; Pakistan,Yes,Pakistani population/family/cohort record,21606,https://www.ncbi.nlm.nih.gov/clinvar/variation/21606/,https://www.ncbi.nlm.nih.gov/clinvar/?term=MCPH+NM_018136.5%3Ac.7782_7783delGA,608716,https://omim.org/entry/608716,https://omim.org/search?index=entry&search=MCPH,https://www.genecards.org/cgi-bin/carddisp.pl?gene=MCPH,https://www.proteinatlas.org/search/MCPH,https://gtexportal.org/home/gene/MCPH,https://rest.ensembl.org/xrefs/symbol/homo_sapiens/MCPH?object_type=gene;content-type=application/json,31853109,https://pubmed.ncbi.nlm.nih.gov/31853109/,https://pubmed.ncbi.nlm.nih.gov/?term=%28MCPH%5BTitle%2FAbstract%5D%29+AND+Pakistan%2A+AND+%28primary+microcephaly+with+intellectual+disability%29,89.5,"Usable, database links generated",Automated normalization plus source-link enrichment. Database fields should be reviewed before clinical use.,MCPH,NM_018136.5:c.7782_7783delGA,p.Lys2595Serfs*6,Nonsense / stop-gain,2,Inferred from HGVS/Ref/Alt/MutationEffect/old column K; not a clinical pathogenicity assertion,Frameshift,Primary microcephaly / neurodevelopmental,Brain / CNS,Pashtun,row-level value from original sheet; spelling normalized only,,Genetic study of Khyber-Pukhtunkhwa resident Pakistani families presenting primary microcephaly with intellectual disability,https://pubmed.ncbi.nlm.nih.gov/31853109/,,https://pubmed.ncbi.nlm.nih.gov/31853109/,https://www.omim.org/search?search=MCPH,https://www.genecards.org/cgi-bin/carddisp.pl?gene=MCPH,https://www.ncbi.nlm.nih.gov/clinvar/?term=MCPH+NM_018136.5%3Ac.7782_7783delGA,https://www.proteinatlas.org/search/MCPH,https://gtexportal.org/home/gene/MCPH,Variant class normalized; verify clinically before publication,High,ASPM-focused MCPH study.
hg38,Chr14,67728892,67816590,,,Hom,germline,Whole-Exome Sequencing Sanger Sequencing,,c.1093delC,Pakistan,ZFYVE26,,NM_015346.4:c.1093delC,NG_011836.2:g.16047delC,NP_056161.2:p.Leu365fs,frameshift,,"In Family A, there are several affected individuals with distinct clinical presentations: including gait abnormalities, intellectual disabilities, muscle atrophy, and dysarthria. The onset of symptoms varies among the affected individuals",Autosomal recessive Hereditary Spastic Paraplegia 15,AR,2865368,612012,37510308,PK_NEURO_0004,ZFYVE26,CHR14,67728892,67816590,67.729,hg38:CHR14:67728892-67816590::,Frameshift,Homozygous,Autosomal recessive,Autosomal recessive Hereditary Spastic Paraplegia 15,Original Disease column,Ataxia / spastic paraplegia,Brain / CNS; Muscle; Skeletal,spastic paraplegia,Pakistan,Not stated,Pakistani population/family/cohort record,2865368,https://www.ncbi.nlm.nih.gov/clinvar/variation/2865368/,https://www.ncbi.nlm.nih.gov/clinvar/?term=ZFYVE26+NM_015346.4%3Ac.1093delC,612012,https://omim.org/entry/612012,https://omim.org/search?index=entry&search=ZFYVE26,https://www.genecards.org/cgi-bin/carddisp.pl?gene=ZFYVE26,https://www.proteinatlas.org/search/ZFYVE26,https://gtexportal.org/home/gene/ZFYVE26,https://rest.ensembl.org/xrefs/symbol/homo_sapiens/ZFYVE26?object_type=gene;content-type=application/json,37510308,https://pubmed.ncbi.nlm.nih.gov/37510308/,https://pubmed.ncbi.nlm.nih.gov/?term=%28ZFYVE26%5BTitle%2FAbstract%5D%29+AND+Pakistan%2A+AND+%28Autosomal+recessive+Hereditary+Spastic+Paraplegia+15%29,78.9,Needs curation: Ethnicity,Automated normalization plus source-link enrichment. Database fields should be reviewed before clinical use.,ZFYVE26,NM_015346.4:c.1093delC,p.Leu365fs,Frameshift deletion,,Inferred from HGVS/Ref/Alt/MutationEffect/old column K; not a clinical pathogenicity assertion,Frameshift,Neurodevelopmental / intellectual disability,"Brain / CNS, Muscle","Pakistani; regional recruitment context reported, exact ethnicity not assigned row-by-row",paper-level population and regional recruitment,https://www.mdpi.com/2073-4425/14/7/1404,Genetic Investigation of Consanguineous Pakistani Families Segregating Rare Spinocerebellar Disorders,https://www.mdpi.com/2073-4425/14/7/1404,https://doi.org/10.3390/genes14071404,https://www.mdpi.com/2073-4425/14/7/1404,https://www.omim.org/search?search=ZFYVE26,https://www.genecards.org/cgi-bin/carddisp.pl?gene=ZFYVE26,https://www.ncbi.nlm.nih.gov/clinvar/?term=ZFYVE26+NM_015346.4%3Ac.1093delC,https://www.proteinatlas.org/search/ZFYVE26,https://gtexportal.org/home/gene/ZFYVE26,Variant class normalized; verify clinically before publication,High,"Reports ZFYVE26 c.1093del, SACS c.1201C>T, BICD2 c.2156A>T, ALS2 c.2171-3T>G, ALS2 c.3145T>A, B4GALNT1 c.334_335dup, FA2H c.159_176del, APTX c.689T>G, SETX c.5308_5311del."
hg38,chr13,23328830,23433702,C,T,Hom,germline,Whole-Exome Sequencing Sanger Sequencing,,,Pakistan,SACS,R401,NM_014363.6:c.1201C>T,NG_012342.1:g.83292C>T,NP_055178.3:p.Arg401Ter,nonsense,rs769212398,"All three affected individuals in Family B exhibit ataxic gait and delayed developmental milestones. The specific age, gender",Charlevoix-SagCharlevoix-Saguenay Spastic Ataxia,AR,843602,604490,37510308,PK_NEURO_0005,SACS,13,23328830,23433702,23.329,hg38:13:23328830-23433702:C:T,Nonsense/stop-gain,Homozygous,Autosomal recessive,Charlevoix-SagCharlevoix-Saguenay Spastic Ataxia,Original Disease column,Ataxia / spastic paraplegia,Brain / CNS; Skeletal,ataxia,Pakistan,Not stated,Pakistani population/family/cohort record,843602,https://www.ncbi.nlm.nih.gov/clinvar/variation/843602/,https://www.ncbi.nlm.nih.gov/clinvar/?term=SACS+NM_014363.6%3Ac.1201C%3ET,604490,https://omim.org/entry/604490,https://omim.org/search?index=entry&search=SACS,https://www.genecards.org/cgi-bin/carddisp.pl?gene=SACS,https://www.proteinatlas.org/search/SACS,https://gtexportal.org/home/gene/SACS,https://rest.ensembl.org/xrefs/symbol/homo_sapiens/SACS?object_type=gene;content-type=application/json,37510308,https://pubmed.ncbi.nlm.nih.gov/37510308/,https://pubmed.ncbi.nlm.nih.gov/?term=%28SACS%5BTitle%2FAbstract%5D%29+AND+Pakistan%2A+AND+%28Charlevoix-SagCharlevoix-Saguenay+Spastic+Ataxia%29,94.7,Needs curation: Ethnicity,Automated normalization plus source-link enrichment. Database fields should be reviewed before clinical use.,SACS,NM_014363.6:c.1201C>T,p.Arg401Ter,Nonsense / stop-gain,,Inferred from HGVS/Ref/Alt/MutationEffect/old column K; not a clinical pathogenicity assertion,Nonsense,Neurodevelopmental / intellectual disability,Brain / CNS,"Pakistani; regional recruitment context reported, exact ethnicity not assigned row-by-row",paper-level population and regional recruitment,https://www.mdpi.com/2073-4425/14/7/1404,Genetic Investigation of Consanguineous Pakistani Families Segregating Rare Spinocerebellar Disorders,https://www.mdpi.com/2073-4425/14/7/1404,https://doi.org/10.3390/genes14071404,https://www.mdpi.com/2073-4425/14/7/1404,https://www.omim.org/search?search=SACS,https://www.genecards.org/cgi-bin/carddisp.pl?gene=SACS,https://www.ncbi.nlm.nih.gov/clinvar/?term=SACS+NM_014363.6%3Ac.1201C%3ET,https://www.proteinatlas.org/search/SACS,https://gtexportal.org/home/gene/SACS,Variant class normalized; verify clinically before publication,High,"Reports ZFYVE26 c.1093del, SACS c.1201C>T, BICD2 c.2156A>T, ALS2 c.2171-3T>G, ALS2 c.3145T>A, B4GALNT1 c.334_335dup, FA2H c.159_176del, APTX c.689T>G, SETX c.5308_5311del."
hg38,chr9,92711363,92764833,A,T,Het,germline,Whole-Exome Sequencing Sanger Sequencin,,,Pakistan,BICD2,Q8TD16,,,p.Lys719Met,,,"Family C symptoms including gait abnormalities, foot deformities, short stature, and motor neuron deterioration symptoms.","Spinal muscular atrophy, lower extremity-predominant, 2A, autosomal dominant",AD,,609797,37510308,PK_NEURO_0006,BICD2,9,92711363,92764833,92.711,hg38:9:92711363-92764833:A:T,SNV,Heterozygous,Autosomal dominant,"Spinal muscular atrophy, lower extremity-predominant, 2A, autosomal dominant",Original Disease column,Neuromuscular / myopathy,Brain / CNS; Muscle; Skeletal,,Pakistan,Not stated,Pakistani population/family/cohort record,,,https://www.ncbi.nlm.nih.gov/clinvar/?term=BICD2+p.Lys719Met,609797,https://omim.org/entry/609797,https://omim.org/search?index=entry&search=BICD2,https://www.genecards.org/cgi-bin/carddisp.pl?gene=BICD2,https://www.proteinatlas.org/search/BICD2,https://gtexportal.org/home/gene/BICD2,https://rest.ensembl.org/xrefs/symbol/homo_sapiens/BICD2?object_type=gene;content-type=application/json,37510308,https://pubmed.ncbi.nlm.nih.gov/37510308/,https://pubmed.ncbi.nlm.nih.gov/?term=%28BICD2%5BTitle%2FAbstract%5D%29+AND+Pakistan%2A+AND+%28Spinal+muscular+atrophy%2C+lower+extremity-predominant%2C+2A%2C+autosomal+dominant%29,73.7,"Needs curation: MutationEffect, ClinVarID, Ethnicity, HGVS NM",Automated normalization plus source-link enrichment. Database fields should be reviewed before clinical use.,BICD2,,p.Lys719Met,SNV,,Inferred from HGVS/Ref/Alt/MutationEffect/old column K; not a clinical pathogenicity assertion,SNV,Neuromuscular / myopathy,"Brain / CNS, Muscle","Pakistani; regional recruitment context reported, exact ethnicity not assigned row-by-row",paper-level population and regional recruitment,https://www.mdpi.com/2073-4425/14/7/1404,Genetic Investigation of Consanguineous Pakistani Families Segregating Rare Spinocerebellar Disorders,https://www.mdpi.com/2073-4425/14/7/1404,https://doi.org/10.3390/genes14071404,https://www.mdpi.com/2073-4425/14/7/1404,https://www.omim.org/search?search=BICD2,https://www.genecards.org/cgi-bin/carddisp.pl?gene=BICD2,https://www.ncbi.nlm.nih.gov/clinvar/?term=BICD2,https://www.proteinatlas.org/search/BICD2,https://gtexportal.org/home/gene/BICD2,Needs manual variant review,Medium,"Reports ZFYVE26 c.1093del, SACS c.1201C>T, BICD2 c.2156A>T, ALS2 c.2171-3T>G, ALS2 c.3145T>A, B4GALNT1 c.334_335dup, FA2H c.159_176del, APTX c.689T>G, SETX c.5308_5311del."
hq38,chr16,74712969,74774820,,,Hom,germline,Whole-Exome Sequencing Sanger Sequencin,,,Pakistan,FA2H,,NM_024306.5 c.159_176del,NG_017070.1 g.5235_5252del,NP_077282.3 p.Arg53_Ile58del,Inflame 18bp del Homozygous,rs759947457,"In Family G with clinical features of a genetic disorder, including hyperreflexia, lower limbs muscle atrophy, Ataxic gait, hyperreflexia, lower limbs muscle atrophy, Mild ataxic gait. The disease has a progressive course with symptoms typically appearing around 3 years of age.Consanguinity within the family may contribute to the inheritance pattern of the disorder",Spastic paraplegia 35,AR,30871,611026,37510308,PK_NEURO_0007,FA2H,16,74712969,74774820,74.713,hq38:16:74712969-74774820::,Deletion,Homozygous,Autosomal recessive,Spastic paraplegia 35,Original Disease column,Ataxia / spastic paraplegia,Brain / CNS; Muscle; Skeletal,spastic paraplegia,Pakistan,Yes,Pakistani population/family/cohort record,30871,https://www.ncbi.nlm.nih.gov/clinvar/variation/30871/,https://www.ncbi.nlm.nih.gov/clinvar/?term=FA2H+NM_024306.5+c.159_176del,611026,https://omim.org/entry/611026,https://omim.org/search?index=entry&search=FA2H,https://www.genecards.org/cgi-bin/carddisp.pl?gene=FA2H,https://www.proteinatlas.org/search/FA2H,https://gtexportal.org/home/gene/FA2H,https://rest.ensembl.org/xrefs/symbol/homo_sapiens/FA2H?object_type=gene;content-type=application/json,37510308,https://pubmed.ncbi.nlm.nih.gov/37510308/,https://pubmed.ncbi.nlm.nih.gov/?term=%28FA2H%5BTitle%2FAbstract%5D%29+AND+Pakistan%2A+AND+%28Spastic+paraplegia+35%29,84.2,Needs curation: Ethnicity,Automated normalization plus source-link enrichment. Database fields should be reviewed before clinical use.,FA2H,c.159_176del,p.Arg53_Ile58del,In-frame deletion,18,Inferred from HGVS/Ref/Alt/MutationEffect/old column K; not a clinical pathogenicity assertion,In-frame deletion,Ataxia / hereditary spastic paraplegia,"Brain / CNS, Muscle","Pakistani; regional recruitment context reported, exact ethnicity not assigned row-by-row",paper-level population and regional recruitment,https://www.mdpi.com/2073-4425/14/7/1404,Genetic Investigation of Consanguineous Pakistani Families Segregating Rare Spinocerebellar Disorders,https://www.mdpi.com/2073-4425/14/7/1404,https://doi.org/10.3390/genes14071404,https://www.mdpi.com/2073-4425/14/7/1404,https://www.omim.org/search?search=FA2H,https://www.genecards.org/cgi-bin/carddisp.pl?gene=FA2H,https://www.ncbi.nlm.nih.gov/clinvar/?term=FA2H+c.159_176del,https://www.proteinatlas.org/search/FA2H,https://gtexportal.org/home/gene/FA2H,Variant class normalized; verify clinically before publication,High,"Reports ZFYVE26 c.1093del, SACS c.1201C>T, BICD2 c.2156A>T, ALS2 c.2171-3T>G, ALS2 c.3145T>A, B4GALNT1 c.334_335dup, FA2H c.159_176del, APTX c.689T>G, SETX c.5308_5311del."
hg38,chr9,132261356,132354986,,,Hom,germline,Whole-Exome Sequencing Sanger Sequencin,,c.5308_5311del,Pakistan,SETX,E1770fs,NM_015046.7:c.5308_5311del,NG_007946.1:g.48161GA[1],NP_055861.3:p.Glu1770fs,frameshift homozygous,rs750959420,"Family I is a multiplex consanguineous family with six affected individuals suffering form Progressive ataxic gait, experienced febrile seizure till 8 years of age, action tremor,dysarthria, nystagmus, Progressive ataxic gait, choreic movement, nystagmus,Progressive ataxic gait, choreic movements, weak eyesight, fainting episodes","Ataxia with oculomotor,apraxia type 2, Spinocerebellar ataxia with axonal neuropathy 2",AD/AR,448333,608465,37510308,PK_NEURO_0008,SETX,9,132261356,132354986,132.261,hg38:9:132261356-132354986::,Frameshift,Homozygous,Autosomal recessive,"Ataxia with oculomotor,apraxia type 2, Spinocerebellar ataxia with axonal neuropathy 2",Original Disease column,Ataxia / spastic paraplegia,Brain / CNS; Peripheral nerve; Eye / retina; Skeletal,seizure; ataxia; neuropathy,Pakistan,Yes,Pakistani population/family/cohort record,448333,https://www.ncbi.nlm.nih.gov/clinvar/variation/448333/,https://www.ncbi.nlm.nih.gov/clinvar/?term=SETX+NM_015046.7%3Ac.5308_5311del,608465,https://omim.org/entry/608465,https://omim.org/search?index=entry&search=SETX,https://www.genecards.org/cgi-bin/carddisp.pl?gene=SETX,https://www.proteinatlas.org/search/SETX,https://gtexportal.org/home/gene/SETX,https://rest.ensembl.org/xrefs/symbol/homo_sapiens/SETX?object_type=gene;content-type=application/json,37510308,https://pubmed.ncbi.nlm.nih.gov/37510308/,https://pubmed.ncbi.nlm.nih.gov/?term=%28SETX%5BTitle%2FAbstract%5D%29+AND+Pakistan%2A+AND+%28Ataxia+with+oculomotor%2Capraxia+type+2%2C+Spinocerebellar+ataxia+with+axonal+neuropathy+2%29,84.2,Needs curation: Ethnicity,Automated normalization plus source-link enrichment. Database fields should be reviewed before clinical use.,SETX,NM_015046.7:c.5308_5311del,p.Glu1770fs,Frameshift deletion,4,Inferred from HGVS/Ref/Alt/MutationEffect/old column K; not a clinical pathogenicity assertion,Frameshift,Ataxia / hereditary spastic paraplegia,"Brain / CNS, Peripheral nerve, Eye","Pakistani; regional recruitment context reported, exact ethnicity not assigned row-by-row",paper-level population and regional recruitment,https://www.mdpi.com/2073-4425/14/7/1404,Genetic Investigation of Consanguineous Pakistani Families Segregating Rare Spinocerebellar Disorders,https://www.mdpi.com/2073-4425/14/7/1404,https://doi.org/10.3390/genes14071404,https://www.mdpi.com/2073-4425/14/7/1404,https://www.omim.org/search?search=SETX,https://www.genecards.org/cgi-bin/carddisp.pl?gene=SETX,https://www.ncbi.nlm.nih.gov/clinvar/?term=SETX+NM_015046.7%3Ac.5308_5311del,https://www.proteinatlas.org/search/SETX,https://gtexportal.org/home/gene/SETX,Variant class normalized; verify clinically before publication,High,"Reports ZFYVE26 c.1093del, SACS c.1201C>T, BICD2 c.2156A>T, ALS2 c.2171-3T>G, ALS2 c.3145T>A, B4GALNT1 c.334_335dup, FA2H c.159_176del, APTX c.689T>G, SETX c.5308_5311del."
hg38,chr2,201700267,201780933,T,A,Hom,germline,Whole-Exome Sequencing Sanger Sequencin,,,Pakistan,ALS2,,,,p.Tyr1049Asn,Missense Homozygous (Uncertain Significance),,"Family E consists of six affected individuals born to three consanguineous couples. The disease symptoms in all affected individuals started to appear at around one year of age and are progressive in nature. Muscle deterioration, progressive loss of movement, bending of hands and feet, dysarthria,dysphagia, hyper salivation, no cognitive deficit.","Infantile ascending, hereditary spastic paraplegia",AR,,606352,37510308,PK_NEURO_0009,ALS2,2,201700267,201780933,201.7,hg38:2:201700267-201780933:T:A,Missense,Homozygous,Autosomal recessive,"Infantile ascending, hereditary spastic paraplegia",Original Disease column,Ataxia / spastic paraplegia,Brain / CNS; Muscle,spastic paraplegia,Pakistan,Yes,Pakistani population/family/cohort record,,,https://www.ncbi.nlm.nih.gov/clinvar/?term=ALS2+p.Tyr1049Asn,606352,https://omim.org/entry/606352,https://omim.org/search?index=entry&search=ALS2,https://www.genecards.org/cgi-bin/carddisp.pl?gene=ALS2,https://www.proteinatlas.org/search/ALS2,https://gtexportal.org/home/gene/ALS2,https://rest.ensembl.org/xrefs/symbol/homo_sapiens/ALS2?object_type=gene;content-type=application/json,37510308,https://pubmed.ncbi.nlm.nih.gov/37510308/,https://pubmed.ncbi.nlm.nih.gov/?term=%28ALS2%5BTitle%2FAbstract%5D%29+AND+Pakistan%2A+AND+%28Infantile+ascending%2C+hereditary+spastic+paraplegia%29,78.9,"Needs curation: ClinVarID, Ethnicity, HGVS NM",Automated normalization plus source-link enrichment. Database fields should be reviewed before clinical use.,ALS2,,p.Tyr1049Asn,Missense,,Inferred from HGVS/Ref/Alt/MutationEffect/old column K; not a clinical pathogenicity assertion,Missense,Ataxia / hereditary spastic paraplegia,"Brain / CNS, Muscle","Pakistani; regional recruitment context reported, exact ethnicity not assigned row-by-row",paper-level population and regional recruitment,https://www.mdpi.com/2073-4425/14/7/1404,Genetic Investigation of Consanguineous Pakistani Families Segregating Rare Spinocerebellar Disorders,https://www.mdpi.com/2073-4425/14/7/1404,https://doi.org/10.3390/genes14071404,https://www.mdpi.com/2073-4425/14/7/1404,https://www.omim.org/search?search=ALS2,https://www.genecards.org/cgi-bin/carddisp.pl?gene=ALS2,https://www.ncbi.nlm.nih.gov/clinvar/?term=ALS2,https://www.proteinatlas.org/search/ALS2,https://gtexportal.org/home/gene/ALS2,Needs manual variant review,Medium,"Reports ZFYVE26 c.1093del, SACS c.1201C>T, BICD2 c.2156A>T, ALS2 c.2171-3T>G, ALS2 c.3145T>A, B4GALNT1 c.334_335dup, FA2H c.159_176del, APTX c.689T>G, SETX c.5308_5311del."
